{
  "$schema": "https://json-schema.org/draft/2020-12/schema",
  "$id": "https://xcodebuildmcp.com/schemas/structured-output/xcodebuildmcp.output.simulator-list/2.schema.json",
  "type": "object",
  "additionalProperties": false,
  "allOf": [
    {
      "$ref": "https://xcodebuildmcp.com/schemas/structured-output/_defs/common.schema.json#/$defs/errorConsistency"
    }
  ],
  "properties": {
    "schema": {
      "const": "xcodebuildmcp.output.simulator-list"
    },
    "schemaVersion": {
      "const": "2"
    },
    "didError": {
      "type": "boolean"
    },
    "error": {
      "type": [
        "string",
        "null"
      ]
    },
    "data": {
      "type": "object",
      "additionalProperties": false,
      "properties": {
        "simulators": {
          "type": "array",
          "items": {
            "type": "object",
            "additionalProperties": false,
            "properties": {
              "name": {
                "type": "string"
              },
              "simulatorId": {
                "type": "string"
              },
              "state": {
                "type": "string"
              },
              "isAvailable": {
                "type": "boolean"
              },
              "runtime": {
                "type": "string"
              }
            },
            "required": [
              "name",
              "simulatorId",
              "state",
              "isAvailable",
              "runtime"
            ]
          }
        }
      },
      "required": [
        "simulators"
      ]
    },
    "nextSteps": {
      "$ref": "https://xcodebuildmcp.com/schemas/structured-output/_defs/common.schema.json#/$defs/nextSteps"
    }
  },
  "required": [
    "schema",
    "schemaVersion",
    "didError",
    "error",
    "data"
  ]
}
